{
  "schemaVersion": "macos-acceptance-v1",
  "generatedAt": "2026-08-16T19:16:39-04:00",
  "campaigns": [
    {
      "id": "bbl-2026-08-16",
      "measuredAt": "2026-08-16T19:16:39-04:00",
      "machine": "arm64 macOS bench",
      "operatingSystem": "Version 26.4 (Build 25E246)",
      "session": "interactive desktop session with a logged-in user",
      "harness": "scripts/macos-toolkit-acceptance",
      "permissions": {
        "accessibility": "granted",
        "automation": null,
        "screenRecording": "notNeeded"
      },
      "rawEvidence": "raw/bbl-2026-08-16.json",
      "notes": null
    }
  ],
  "rows": [
    {
      "id": "safari-click-2026-08-16",
      "campaign": "bbl-2026-08-16",
      "target": {
        "label": "safari",
        "kind": "webkit-browser",
        "identity": {
          "bundleId": "com.apple.Safari",
          "bundleShortVersion": "26.4",
          "bundleVersion": "21624.1.16.11.4",
          "versionSeries": "26.4",
          "runtimeSignature": null,
          "readableAtDispatch": true,
          "source": "NSRunningApplication(processIdentifier:) then the bundle's Info.plist",
          "processStartTime": "Sun Aug 16 19:16:05 2026"
        }
      },
      "action": "click",
      "mechanism": "CGEventPostToPid",
      "variant": "leftMouseDown+leftMouseUp/source=null/gapMs=0",
      "verdict": "blocked",
      "reason": "the foreground control before the dispatch did not act, so this trial is measuring the campaign rather than the target",
      "observations": {
        "dispatchAccepted": true,
        "targetMutated": false,
        "mutationEvidence": "the page neither navigated nor reported a click",
        "eventReachedTarget": false,
        "arrivalDetail": "the page's event listeners recorded nothing",
        "frontmostUnchanged": true,
        "decoyFrontmost": true,
        "pointerUnchanged": true,
        "ownershipProved": true,
        "pointerBefore": {
          "x": 2554,
          "y": 1434
        },
        "pointerAfter": {
          "x": 2554,
          "y": 1434
        },
        "frontmostBefore": "dev.axon.acceptance.decoy",
        "frontmostAfter": "dev.axon.acceptance.decoy",
        "targetPid": 53388,
        "windowId": 2843,
        "point": {
          "x": 1093.2578125,
          "y": 208.5
        },
        "nonce": "ecfa0d39c662"
      },
      "controls": {
        "before": {
          "ran": true,
          "acted": false,
          "mechanism": "CGEventPost(kCGHIDEventTap) with the real pointer over the coordinate",
          "detail": "the page neither navigated nor reported a click"
        },
        "after": {
          "ran": true,
          "acted": false,
          "mechanism": "CGEventPost(kCGHIDEventTap) with the real pointer over the coordinate",
          "detail": "the page neither navigated nor reported a click"
        }
      },
      "freshState": {
        "fresh": false,
        "detail": "a foreground control click preceded the measured dispatch, which is what licenses the click trial; a keyboard verdict is never taken from a trial shaped this way"
      },
      "rawEvidence": "raw/bbl-2026-08-16.json#safari-click",
      "remeasureWhen": "a Safari or macOS major release"
    },
    {
      "id": "safari-keyboard-2026-08-16",
      "campaign": "bbl-2026-08-16",
      "target": {
        "label": "safari",
        "kind": "webkit-browser",
        "identity": {
          "bundleId": "com.apple.Safari",
          "bundleShortVersion": "26.4",
          "bundleVersion": "21624.1.16.11.4",
          "versionSeries": "26.4",
          "runtimeSignature": null,
          "readableAtDispatch": true,
          "source": "NSRunningApplication(processIdentifier:) then the bundle's Info.plist",
          "processStartTime": "Sun Aug 16 19:16:22 2026"
        }
      },
      "action": "keyboard",
      "mechanism": "CGEventPostToPid",
      "variant": "keyDown+keyUp/source=null",
      "verdict": "accepted",
      "reason": "the target acted on input posted to its process while a decoy held the foreground and the real pointer did not move",
      "observations": {
        "dispatchAccepted": true,
        "targetMutated": true,
        "mutationEvidence": "the page's input read 'axon' before and 'axonaxon' after",
        "eventReachedTarget": true,
        "arrivalDetail": "the page observed keydown isTrusted=True, keyup isTrusted=True, keydown isTrusted=True, keyup isTrusted=True, keydown isTrusted=True, keyup isTrusted=True, keydown isTrusted=True, keyup isTrusted=True",
        "frontmostUnchanged": true,
        "decoyFrontmost": true,
        "pointerUnchanged": true,
        "ownershipProved": true,
        "pointerBefore": {
          "x": 2554,
          "y": 1434
        },
        "pointerAfter": {
          "x": 2554,
          "y": 1434
        },
        "frontmostBefore": "dev.axon.acceptance.decoy",
        "frontmostAfter": "dev.axon.acceptance.decoy",
        "targetPid": 54759,
        "windowId": 2858,
        "point": null,
        "nonce": "baf86047030d"
      },
      "controls": {
        "before": {
          "ran": true,
          "acted": true,
          "mechanism": "CGEventPost(kCGHIDEventTap) with the target activated",
          "detail": "the page's input read '' before and 'axon' after"
        },
        "after": {
          "ran": true,
          "acted": true,
          "mechanism": "CGEventPost(kCGHIDEventTap) with the target activated",
          "detail": "the page's input read 'axonaxon' before and 'axon axonaxon' after"
        }
      },
      "freshState": {
        "fresh": true,
        "detail": "the measured keystrokes were the first synthetic input this target received: its foreground control was a keystroke, not a click"
      },
      "rawEvidence": "raw/bbl-2026-08-16.json#safari-keyboard",
      "remeasureWhen": "a Safari or macOS major release"
    }
  ]
}
